{
  "schema_version": "1.0.0",
  "index_type": "file_type_index",
  "index_id": "fictional-public-file-type-index",
  "generated_at_utc": "2026-08-20T07:01:00Z",
  "indexer": {
    "name": "File-Type Explorer Indexer",
    "version": "0.2.0",
    "platform": "Windows",
    "mode": "metadata_only"
  },
  "drive": {
    "drive_letter": "C:",
    "volume_label": "Fictional Portfolio Drive",
    "filesystem": "NTFS",
    "total_bytes": 500000000,
    "used_bytes": 300000000,
    "free_bytes": 200000000,
    "observed_at_utc": "2026-08-20T07:01:00Z"
  },
  "scan": {
    "started_at_utc": "2026-08-20T07:00:00Z",
    "completed_at_utc": "2026-08-20T07:01:00Z",
    "duration_ms": 60000,
    "status": "complete",
    "aggregate_coverage": "exact",
    "files_examined": 3,
    "directories_examined": 4,
    "logical_bytes_observed": 30000,
    "zero_byte_files": 1,
    "matching_files": 2,
    "matching_logical_bytes": 30000,
    "inaccessible_path_details_retained": 0,
    "inaccessible_path_details_omitted": 0,
    "scan_error_details_retained": 0,
    "scan_error_details_omitted": 0
  },
  "scope": {
    "root_path": "C:\\",
    "recursive": true,
    "explicitly_requested": true
  },
  "extension_groups": [
    {"group_id": "documents", "label": "Documents", "extensions": [".pdf", ".doc", ".docx", ".odt", ".rtf", ".txt", ".ppt", ".pptx", ".xls", ".xlsx"]},
    {"group_id": "videos", "label": "Videos", "extensions": [".mp4", ".mkv", ".avi", ".mov", ".wmv", ".webm"]},
    {"group_id": "audio", "label": "Audio", "extensions": [".mp3", ".wav", ".flac", ".m4a", ".aac"]},
    {"group_id": "images", "label": "Images", "extensions": [".jpg", ".jpeg", ".png", ".gif", ".webp", ".heic"]},
    {"group_id": "archives_disk_images", "label": "Archives and disk images", "extensions": [".zip", ".rar", ".7z", ".tar", ".gz", ".iso"]},
    {"group_id": "installers", "label": "Installers", "extensions": [".exe", ".msi", ".msix", ".appx"]}
  ],
  "custom_extensions": [],
  "folders": [
    {
      "folder_id": "folder-root",
      "parent_id": null,
      "path": "C:\\",
      "name": "C:\\",
      "depth": 0,
      "direct_file_count": 0,
      "recursive_file_count": 3,
      "direct_logical_bytes": 0,
      "recursive_logical_bytes": 30000,
      "direct_zero_byte_files": 0,
      "recursive_zero_byte_files": 1,
      "extension_totals": [
        {"extension": ".pdf", "direct_file_count": 0, "direct_logical_bytes": 0, "recursive_file_count": 1, "recursive_logical_bytes": 10000},
        {"extension": ".mp4", "direct_file_count": 0, "direct_logical_bytes": 0, "recursive_file_count": 1, "recursive_logical_bytes": 20000}
      ],
      "access": {"state": "normal", "reason_code": "explicit_drive_scope", "explanation": "The fictional drive root was explicitly selected for analysis."}
    },
    {
      "folder_id": "folder-users",
      "parent_id": "folder-root",
      "path": "C:\\Users",
      "name": "Users",
      "depth": 1,
      "direct_file_count": 0,
      "recursive_file_count": 3,
      "direct_logical_bytes": 0,
      "recursive_logical_bytes": 30000,
      "direct_zero_byte_files": 0,
      "recursive_zero_byte_files": 1,
      "extension_totals": [
        {"extension": ".pdf", "direct_file_count": 0, "direct_logical_bytes": 0, "recursive_file_count": 1, "recursive_logical_bytes": 10000},
        {"extension": ".mp4", "direct_file_count": 0, "direct_logical_bytes": 0, "recursive_file_count": 1, "recursive_logical_bytes": 20000}
      ],
      "access": {"state": "normal", "reason_code": "user_content_container", "explanation": "The fictional profile hierarchy is visible for navigation."}
    },
    {
      "folder_id": "folder-profile",
      "parent_id": "folder-users",
      "path": "C:\\Users\\fictional.user",
      "name": "fictional.user",
      "depth": 2,
      "direct_file_count": 0,
      "recursive_file_count": 3,
      "direct_logical_bytes": 0,
      "recursive_logical_bytes": 30000,
      "direct_zero_byte_files": 0,
      "recursive_zero_byte_files": 1,
      "extension_totals": [
        {"extension": ".pdf", "direct_file_count": 0, "direct_logical_bytes": 0, "recursive_file_count": 1, "recursive_logical_bytes": 10000},
        {"extension": ".mp4", "direct_file_count": 0, "direct_logical_bytes": 0, "recursive_file_count": 1, "recursive_logical_bytes": 20000}
      ],
      "access": {"state": "normal", "reason_code": "fictional_profile", "explanation": "The fictional profile is available for manual review."}
    },
    {
      "folder_id": "folder-downloads",
      "parent_id": "folder-profile",
      "path": "C:\\Users\\fictional.user\\Downloads",
      "name": "Downloads",
      "depth": 3,
      "direct_file_count": 3,
      "recursive_file_count": 3,
      "direct_logical_bytes": 30000,
      "recursive_logical_bytes": 30000,
      "direct_zero_byte_files": 1,
      "recursive_zero_byte_files": 1,
      "extension_totals": [
        {"extension": ".pdf", "direct_file_count": 1, "direct_logical_bytes": 10000, "recursive_file_count": 1, "recursive_logical_bytes": 10000},
        {"extension": ".mp4", "direct_file_count": 1, "direct_logical_bytes": 20000, "recursive_file_count": 1, "recursive_logical_bytes": 20000}
      ],
      "access": {"state": "normal", "reason_code": "user_content", "explanation": "Personal files remain subject to explicit human review."}
    }
  ],
  "empty_summary": {"zero_byte_files": 1, "collapsed_tree_count": 0, "trees": []},
  "file_detail_summary": {
    "coverage": "complete",
    "retained_files": 2,
    "omitted_files": 0,
    "retained_logical_bytes": 30000,
    "omitted_logical_bytes": 0
  },
  "files": [
    {"file_id": "file-001", "folder_id": "folder-downloads", "path": "C:\\Users\\fictional.user\\Downloads\\fictional-guide.pdf", "name": "fictional-guide.pdf", "extension": ".pdf", "size_bytes": 10000, "modified_at_utc": "2023-01-02T03:04:05Z", "selection_state": "selectable", "protection_reason": "Personal files require explicit human review."},
    {"file_id": "file-002", "folder_id": "folder-downloads", "path": "C:\\Users\\fictional.user\\Downloads\\fictional-demo.mp4", "name": "fictional-demo.mp4", "extension": ".mp4", "size_bytes": 20000, "modified_at_utc": "2022-02-03T04:05:06Z", "selection_state": "selectable", "protection_reason": "Personal files require explicit human review."}
  ],
  "inaccessible_paths": [],
  "scan_errors": [],
  "limitations": [
    "This public sample contains fictional paths and deliberately small values.",
    "One zero-byte file is counted in aggregate and omitted from the file rows."
  ]
}
